{
  "id": "por-cqu-002",
  "version": 1,
  "discipline": "portugues",
  "concept": "escrever-c-qu",
  "bncc": ["EF02LP03"],
  "year": 2,
  "difficulty": 1,
  "mechanic": "escrever_palavra",
  "params": { "word": "copo", "image": "copo" },
  "prompt": "Esta criatura se chama copo. Escreva o nome dela, letra por letra.",
  "hints": ["Ouça de novo: copo. Pense nos sons, um de cada vez.", "A primeira letra é a C.", "A palavra tem 4 letras e termina com a letra O."],
  "explanation": "O nome é COPO, escrito com 4 letras.",
  "accessibility": { "timerAllowed": false },
  "review": { "status": "pending" }
}
