{
  "id": "por-let-006",
  "version": 1,
  "discipline": "portugues",
  "concept": "nome-e-som-das-letras",
  "bncc": ["EF01LP10","EF01LP04"],
  "year": 1,
  "difficulty": 3,
  "mechanic": "formar_palavras",
  "params": { "syllables": ["na","ta"], "pool": ["ma","me","mi","mo","mu","pa","pe","pi","po","pu","ta","te","ti","to","tu","na","ne","ni","no","nu"], "distractors": 4, "image": "nata" },
  "prompt": "Esta criatura se chama nata. A letra N se chama nê e faz o som de n. Junte as sílabas do nome, olhando bem as letras.",
  "hints": ["Ouça: nnnata. O começo tem o som de n.", "A letra T se chama tê e faz o som de t. Ela vem na segunda sílaba.", "Comece pela sílaba que começa com N."],
  "explanation": "NATA começa com N e a segunda sílaba começa com T.",
  "accessibility": { "timerAllowed": false },
  "review": { "status": "pending" }
}
