{
  "id": "mat-din-a3-001",
  "version": 1,
  "discipline": "matematica",
  "concept": "sistema-monetario",
  "bncc": [
    "EF03MA24"
  ],
  "year": 3,
  "difficulty": 5,
  "mechanic": "pagar_troco",
  "params": {
    "task": "troco",
    "price": 750,
    "given": 1000,
    "pieces": [
      5,
      10,
      25,
      50,
      100,
      200,
      500,
      1000,
      2000
    ]
  },
  "prompt": "O fruta custa R$ 7,50 e você deu uma nota de R$ 10,00. Monte o troco!",
  "hints": [
    "O troco é o que sobra da nota depois de pagar o preço.",
    "De R$ 7,50 até R$ 10,00 falta quanto?",
    "Peça a dica para ver a próxima peça."
  ],
  "explanation": "R$ 10,00 menos R$ 7,50 é R$ 2,50: esse é o troco.",
  "accessibility": {
    "timerAllowed": false
  },
  "review": {
    "status": "pending"
  }
}
