{
  "id": "mat-comp5-002",
  "version": 1,
  "discipline": "matematica",
  "concept": "composicao-ate-5",
  "bncc": ["EF01MA07", "EF01MA02"],
  "year": 1,
  "difficulty": 1,
  "mechanic": "compor_numero",
  "params": { "target": 3, "pieces": [1,2,4], "maxPieces": 2 },
  "prompt": "Monte o número 3 para desfazer a nuvenzinha!",
  "hints": [
    "Olhe os pontinhos de cada peça e veja quantos faltam para chegar a 3.",
    "Comece pela peça 1.",
    "1 e mais quanto dá 3?"
  ],
  "explanation": "1 + 2 = 3. Juntamos as peças e chegamos a 3.",
  "accessibility": { "timerAllowed": false },
  "review": { "status": "pending" }
}
