{
  "id": "por-cqu-005",
  "version": 1,
  "discipline": "portugues",
  "concept": "escrever-c-qu",
  "bncc": ["EF02LP03"],
  "year": 2,
  "difficulty": 3,
  "mechanic": "escrever_palavra",
  "params": { "word": "aqui", "image": "aqui" },
  "prompt": "Esta criatura se chama aqui. O som de k antes de e e i se escreve com QU. Escreva o nome dela, letra por letra.",
  "hints": ["Ouça de novo: aqui. Pense nos sons, um de cada vez.", "A primeira letra é a A.", "A palavra tem 4 letras e termina com a letra I."],
  "explanation": "O nome é AQUI, escrito com 4 letras.",
  "accessibility": { "timerAllowed": false },
  "review": { "status": "pending" }
}
