{
  "id": "mat-fatos20-005",
  "version": 1,
  "discipline": "matematica",
  "concept": "fatos-adicao-subtracao-ate-20",
  "bncc": ["EF02MA05"],
  "year": 2,
  "difficulty": 3,
  "mechanic": "compor_numero",
  "params": { "target": 18, "pieces": [20,2,5], "maxPieces": 2 },
  "prompt": "Faça 18 tirando de 20.",
  "hints": ["Comece pela peça 20 e use o sinal de menos.", "20 menos quanto dá 18?", "A peça 2 serve."],
  "explanation": "20 - 2 = 18.",
  "accessibility": { "timerAllowed": false },
  "review": { "status": "pending" }
}
