{
  "id": "por-pbtdfv-006",
  "version": 1,
  "discipline": "portugues",
  "concept": "escrever-p-b-t-d-f-v",
  "bncc": ["EF02LP03"],
  "year": 2,
  "difficulty": 3,
  "mechanic": "escrever_palavra",
  "params": { "word": "dia", "image": "dia" },
  "prompt": "Esta criatura se chama dia. É dia com D, não tia com T. Escreva o nome dela, letra por letra.",
  "hints": ["Ouça de novo: dia. Pense nos sons, um de cada vez.", "A primeira letra é a D.", "A palavra tem 3 letras e termina com a letra A."],
  "explanation": "O nome é DIA, escrito com 3 letras.",
  "accessibility": { "timerAllowed": false },
  "review": { "status": "pending" }
}
