{
  "id": "mat-comp10-005",
  "version": 1,
  "discipline": "matematica",
  "concept": "composicao-ate-10",
  "bncc": ["EF01MA07"],
  "year": 1,
  "difficulty": 2,
  "mechanic": "compor_numero",
  "params": { "target": 10, "pieces": [3,7,6,5], "maxPieces": 2 },
  "prompt": "Monte o número 10 com duas peças para soltar a pipa!",
  "hints": [
    "Olhe os pontinhos de cada peça e veja quantos faltam para chegar a 10.",
    "Comece pela peça 3.",
    "3 e mais quanto dá 10?"
  ],
  "explanation": "3 + 7 = 10. Juntamos as peças e chegamos a 10.",
  "accessibility": { "timerAllowed": false },
  "review": { "status": "pending" }
}
